{
  "$schema": "https://json-schema.org/draft/2020-12/schema",
  "$id": "https://theory-of-change-agent.dev/pdm/v1",
  "title": "KOICA PDM",
  "description": "ID-linked results-chain DAG for a KOICA Project Design Matrix. Describes the data format only; KOICA guideline rules (e.g. output count 3-4) are enforced by checklist.json / validate-critical.sh, not by this schema.",
  "type": "object",
  "required": ["meta", "impact", "outcomes", "outputs", "activities", "inputs"],
  "properties": {
    "meta": {
      "type": "object",
      "required": ["project_name", "version", "created_at", "lang"],
      "properties": {
        "project_name": { "type": "string" },
        "version": { "type": "string", "pattern": "^\\d+\\.\\d+$" },
        "created_at": { "type": "string", "format": "date" },
        "approved_at": { "type": ["string", "null"] },
        "lang": { "type": "string", "enum": ["ko", "en"] },
        "use_case": { "type": "string", "enum": ["intl-dev", "biz-dev", "csr-esg", "nonprofit", "invest-screen"], "description": "What the user is doing (asked first, before mode). Confirmed labels (2026-07-09): intl-dev = 국제개발협력(PDM) — PDM matrix view, 사업 단위; biz-dev = 임팩트 스타트업(신규사업개발) — ToC view, 조직 단위 가능; csr-esg = 사회공헌(CSR, ESG) — ToC view, 사업 단위; nonprofit = 비영리(재단·NGO) — ToC view, 조직 단위 가능(연차보고서 입력 잦음); invest-screen = 임팩트 투자사 (투심; backlog, not offered). The results-chain logic is identical across use-cases; only the rendered end-view and which structures are required differ. ToC-view use-cases = biz-dev, csr-esg, nonprofit." },
        "unit": { "type": "string", "enum": ["project", "org"], "description": "입력 단위. project = 사업(프로젝트) 하나 (intl-dev, csr-esg 기본). org = 조직 단위 입력 (biz-dev, nonprofit에서 가능 — 다수 프로젝트 포함 문서). 변화이론은 프로젝트 단위로 만들어지므로, org 입력이며 다수 프로젝트가 감지되면 사용자에게 [전체 프로젝트 vs 특정 프로젝트] 분기를 물어야 한다 (SKILL Phase 1 step 0b)." },
        "org_context": { "type": ["object", "null"], "description": "unit=org일 때의 조직 컨텍스트. 특정 프로젝트를 골라 내려간 경우에도 부모 조직 정보를 보존한다.", "properties": {
          "org_name": { "type": "string" },
          "mission": { "type": ["string", "null"], "description": "조직 미션 — 전체 프로젝트 뷰에서 각 프로젝트가 미션과 어떻게 연결되는지 보여주는 축." },
          "projects": { "type": "array", "items": { "type": "object", "properties": { "name": { "type": "string" }, "summary": { "type": ["string", "null"] } }, "required": ["name"] }, "description": "입력에서 감지된 프로젝트 목록." },
          "selected_project": { "type": ["string", "null"], "description": "특정 프로젝트 분기에서 사용자가 고른 프로젝트 이름. 전체 프로젝트 뷰면 null." }
        } },
        "input_source": { "type": "string", "enum": ["concept", "inputs"], "description": "Q1 of Phase 1: concept = user has only an idea; inputs = user has documents (plan/draft/existing PDM) to read." },
        "interaction": { "type": "string", "enum": ["interview", "draft"], "description": "Q2 of Phase 1: interview = step-by-step Q&A; draft = table-first (generate a draft then edit)." },
        "mode": { "type": "string", "enum": ["A", "B", "C"], "description": "Resolved legacy label: A = concept+interview, B = inputs+interview (also inputs+draft, with gate_mode DRAFT), C = concept+draft. Derived from input_source × interaction." },
        "gate_mode": { "type": "string", "enum": ["GATE", "AUDIT", "DRAFT"], "description": "GATE = new PDM (blocking); AUDIT = existing/approved PDM (report-only); DRAFT = draft-first work-in-progress (report-only until the user finalizes, which flips it to GATE)" },
        "headline_indicator": { "type": "string", "description": "대표 수혜자 지표/목표치 (top-line)" },
        "sdgs_koica_indicator": { "type": "string" }
      }
    },
    "impact": {
      "type": "object",
      "required": ["id", "narrative"],
      "description": "Per KOICA guideline p.23, Impact has NO indicators/MoV. The schema permits the optional 'indicators'/'mov' fields ONLY so AUDIT mode can represent real/approved PDMs that deviate; rule C01 flags them in GATE mode.",
      "properties": {
        "id": { "type": "string", "pattern": "^imp-\\d+$" },
        "narrative": { "type": "string", "description": "Strategic goal statement" },
        "sdgs": { "type": "array", "items": { "type": "string" }, "description": "SDG targets (e.g. 'SDG 8.3')" },
        "national_strategy": { "type": "string", "description": "Recipient country dev strategy alignment" },
        "assumptions_from_outcome": { "type": "array", "items": { "type": "string" }, "description": "Assumptions for Outcome->Impact link" },
        "indicators": { "type": "array", "items": { "$ref": "#/$defs/indicator" }, "description": "AUDIT/ingestion only — guideline-noncompliant; flagged by rule C01" },
        "mov": { "type": "array", "items": { "type": "string" }, "description": "AUDIT/ingestion only — guideline-noncompliant; flagged by rule C01" },
        "stale": { "type": "boolean", "default": false }
      }
    },
    "outcomes": {
      "type": "array",
      "minItems": 1,
      "description": "Outcome count is unconstrained at every layer; the prior single-outcome rule (C07) was removed 2026-06-05.",
      "items": {
        "type": "object",
        "required": ["id", "narrative", "indicators", "from_outputs"],
        "properties": {
          "id": { "type": "string", "pattern": "^oc-\\d+$" },
          "narrative": { "type": "string", "description": "Behavioral change statement" },
          "indicators": { "type": "array", "minItems": 1, "items": { "$ref": "#/$defs/indicator" } },
          "mov": { "type": "array", "items": { "type": "string" } },
          "assumptions": { "type": "array", "items": { "type": "string" }, "description": "Assumptions for Output->Outcome link" },
          "from_outputs": { "type": "array", "items": { "type": "string", "pattern": "^op-\\d+$" }, "description": "Output IDs feeding this outcome" },
          "stale": { "type": "boolean", "default": false }
        }
      }
    },
    "outputs": {
      "type": "array",
      "minItems": 1,
      "description": "Schema permits any count for ingestion; output count 3-4 is enforced as rule C02.",
      "items": {
        "type": "object",
        "required": ["id", "narrative", "indicators", "from_activities"],
        "properties": {
          "id": { "type": "string", "pattern": "^op-\\d+$" },
          "narrative": { "type": "string", "description": "Noun-form deliverable (goods/services)" },
          "indicators": { "type": "array", "minItems": 1, "items": { "$ref": "#/$defs/indicator" } },
          "mov": { "type": "array", "items": { "type": "string" } },
          "assumptions": { "type": "array", "items": { "type": "string" }, "description": "Assumptions for Activity->Output link" },
          "from_activities": { "type": "array", "items": { "type": "string", "pattern": "^act-\\d+(\\.\\d+)?$" }, "description": "Activity IDs that produce this output" },
          "stale": { "type": "boolean", "default": false }
        }
      }
    },
    "activities": {
      "type": "array",
      "minItems": 1,
      "items": {
        "type": "object",
        "required": ["id", "text"],
        "properties": {
          "id": { "type": "string", "pattern": "^act-\\d+$" },
          "text": { "type": "string", "description": "Activity description" },
          "sub": {
            "type": "array",
            "items": {
              "type": "object",
              "required": ["id", "text"],
              "properties": {
                "id": { "type": "string", "pattern": "^act-\\d+\\.\\d+$" },
                "text": { "type": "string" }
              }
            }
          },
          "stale": { "type": "boolean", "default": false }
        }
      }
    },
    "inputs": {
      "type": "object",
      "required": ["koica"],
      "description": "투입물. ODA/intl-dev construct (KOICA 사업은 전체 예산 기반). For ToC-view use-cases (biz-dev/csr-esg/nonprofit), keep minimal and omit the recipient/수원기관 block (koica-rules.md §11.1).",
      "properties": {
        "koica": {
          "type": "object",
          "properties": {
            "budget": { "type": ["string", "null"] },
            "duration": { "type": ["string", "null"] },
            "personnel": { "type": ["string", "null"] }
          }
        },
        "recipient": {
          "type": "object",
          "description": "수원기관 분담재원/기타자원. ODA/intl-dev only — OMIT for ToC-view use-cases (biz-dev/csr-esg/nonprofit) (the target is the end beneficiary, not a recipient institution).",
          "properties": {
            "contribution": { "type": ["string", "null"] },
            "other_resources": { "type": ["string", "null"] }
          }
        },
        "pre_conditions": { "type": "array", "items": { "type": "string" }, "description": "Pre-conditions for activities to proceed" }
      }
    },
    "budget": {
      "type": ["object", "null"],
      "description": "사업 예산 (intl-dev MVP — koica-rules.md §12). Mirrors the KOICA budget-sheet skeleton: 관(직접/간접/일반관리) → 항(=PDM Output) → 목(=PDM Activity) → 세목(line). 산출근거 = 단가 × 수량 × 횟수 (× 개월). ALL sums/ratios/derived amounts are computed deterministically by rules/budget-rollup.py — the LLM never does the arithmetic. Line amounts may be null (the script computes them from basis).",
      "properties": {
        "currency": { "type": "string", "default": "KRW" },
        "years": { "type": "array", "items": { "type": "string" }, "description": "연차 labels, e.g. [\"1차년\",\"2차년\"] — derived from inputs.koica.duration." },
        "funders": {
          "type": "array", "minItems": 1,
          "items": { "type": "object", "required": ["id", "name"], "properties": {
            "id": { "type": "string", "description": "share key, e.g. \"koica\", \"partner\"" },
            "name": { "type": "string" },
            "pledged": { "type": ["number", "null"], "description": "약정 분담금 총액 (optional — checked against rollup if given)" } } },
          "description": "분담 주체 (e.g. KOICA + 파트너). Every line's shares keys must be funder ids."
        },
        "direct": {
          "type": "array",
          "description": "직접사업비 — the ONLY 관 linked to the PDM results chain. One entry per PDM Output(항), each with its Activities(목) carrying 세목 lines.",
          "items": { "type": "object", "required": ["output_id", "activities"], "properties": {
            "output_id": { "type": "string", "pattern": "^op-\\d+$", "description": "must exist in pdm.json outputs" },
            "activities": { "type": "array", "items": { "type": "object", "required": ["activity_id", "lines"], "properties": {
              "activity_id": { "type": "string", "pattern": "^act-\\d+(\\.\\d+)?$", "description": "must exist in pdm.json activities (or sub)" },
              "lines": { "type": "array", "items": { "$ref": "#/$defs/budget_line" } } } } } } }
        },
        "indirect": {
          "type": "array",
          "description": "간접사업비 (현지사무소 운영, 본부사업지원 인건비 등) — 결과사슬 밖, PDM 노드에 연결하지 않는다.",
          "items": { "type": "object", "required": ["name", "lines"], "properties": {
            "id": { "type": "string" }, "name": { "type": "string" },
            "lines": { "type": "array", "items": { "$ref": "#/$defs/budget_line" } } } }
        },
        "general_mgmt": {
          "type": ["object", "null"],
          "description": "일반관리비 — rate × (직접 + 간접). KOICA 통상 5% 상한. amount는 null로 두면 스크립트가 계산.",
          "properties": {
            "rate": { "type": "number", "default": 0.05 },
            "amount": { "type": ["number", "null"] },
            "note": { "type": ["string", "null"] } }
        }
      }
    }
  },
  "$defs": {
    "budget_line": {
      "type": "object",
      "required": ["name"],
      "description": "세목 (budget line). Must carry basis and/or amount: with basis only, budget-rollup.py computes amount = unit_price × qty × freq × (months||1); with both, the script verifies they agree.",
      "properties": {
        "id": { "type": "string", "description": "optional stable id, e.g. \"bl-1.1.1\"" },
        "name": { "type": "string", "description": "세목명, e.g. \"스타트업 투자금\", \"현지 PM 인건비\"" },
        "basis": { "type": ["object", "null"], "description": "산출근거 — the expression, never a made-up total.", "properties": {
          "unit_price": { "type": "number", "description": "단가(원)" },
          "qty": { "type": "number", "description": "수량 (인원/건수/일수 등)" },
          "freq": { "type": "number", "default": 1, "description": "횟수" },
          "months": { "type": ["number", "null"], "description": "개월 (인건비·임차료 등 월단가일 때만)" },
          "note": { "type": ["string", "null"], "description": "근거 설명, e.g. \"월 인건비 x 13개월\"" } } },
        "amount": { "type": ["number", "null"], "description": "금액(원). null이면 스크립트가 basis로 계산." },
        "shares": { "type": ["object", "null"], "additionalProperties": { "type": "number" }, "description": "funder id → 분담액. 합이 amount와 일치해야 함 (스크립트 검증). null이면 미배분(경고)." },
        "year": { "type": ["string", "null"], "description": "연차 label (budget.years 중 하나). null = 미배분." },
        "note": { "type": ["string", "null"] }
      }
    },
    "indicator": {
      "type": "object",
      "required": ["id", "name"],
      "properties": {
        "id": { "type": "string", "pattern": "^ind-[a-z]+-\\d+(\\.\\d+)*$" },
        "name": { "type": "string" },
        "definition": { "type": "string", "description": "What the indicator measures, in one line (지표 정의)." },
        "formula": { "type": ["string", "null"], "description": "산출식 — the calculation, when derivable (rate/ratio/index/count): e.g. \"시설분만율 = 시설분만 건수 ÷ 전체 분만 건수 × 100\". Null for purely qualitative indicators." },
        "measurement_target": { "type": ["string", "null"], "description": "측정 대상 — what/whom is being measured (사회공헌·비영리 지표 DB column). Fill ONLY for ToC-view use-cases (biz-dev/csr-esg/nonprofit); null for intl-dev (KOICA PDM), which does not use this column." },
        "baseline": { "type": ["string", "number", "null"], "description": "Deferred by default: the canonical placeholder is the string \"추후 확정\" (set post-finalization from field survey — koica-rules.md §4.8). A concrete value may be supplied if the user volunteers one." },
        "target": { "type": ["string", "number", "null"], "description": "Deferred by default: canonical placeholder \"추후 확정\". When deferred, A05 (target realism) is N/A. koica-rules.md §4.8." },
        "target_rationale": { "type": ["string", "null"], "description": "Deferred with the target ('추후 확정') unless a concrete target is supplied." },
        "mov": { "type": "string", "description": "Means of Verification for this indicator (required non-empty by rule C04)" },
        "data_source": { "type": "string" },
        "timing": { "type": "string", "description": "Measurement timing/frequency" },
        "collector": { "type": "string", "description": "Who collects the data" },
        "disaggregation": { "type": ["string", "null"], "description": "e.g. gender, region, age" },
        "is_proxy": { "type": "boolean", "default": false },
        "proxy_justification": { "type": ["string", "null"] }
      }
    }
  }
}
